{
  "schema_version": "m3.1",
  "base_revision": 3,
  "nodes": [
    {
      "id": "invalid_config_error",
      "parent_id": "stage",
      "title": "定义 InvalidConfigError",
      "type": "ATOMIC",
      "requirement_refs": ["R-003"],
      "origin": "DERIVED",
      "derivation_reason": "现有代码尚未定义需求指定的异常，需先提供该异常供两条校验规则使用。"
    },
    {
      "id": "validate_provider",
      "parent_id": "stage",
      "title": "限制 provider 的可用值",
      "type": "ATOMIC",
      "requirement_refs": ["R-003"],
      "origin": "EXPLICIT",
      "derivation_reason": ""
    },
    {
      "id": "validate_timeout",
      "parent_id": "stage",
      "title": "校验可选 timeout 为正整数",
      "type": "ATOMIC",
      "requirement_refs": ["R-003"],
      "origin": "EXPLICIT",
      "derivation_reason": ""
    }
  ],
  "atomic_task_drafts": [
    {
      "node_id": "invalid_config_error",
      "title": "定义 InvalidConfigError",
      "requirement_refs": ["R-003"],
      "origin": "DERIVED",
      "derivation_reason": "需求要求校验失败时抛出 InvalidConfigError，而当前 config_loader.py 中没有该异常。",
      "allowed_change_paths": ["config_loader.py"],
      "properties": [
        {
          "statement": "config_loader.py 提供可供 validate_config 抛出的 InvalidConfigError。",
          "requirement_refs": ["R-003"],
          "origin": "DERIVED",
          "derivation_reason": "实现需求指定的异常所必需。"
        }
      ]
    },
    {
      "node_id": "validate_provider",
      "title": "限制 provider 的可用值",
      "requirement_refs": ["R-003"],
      "origin": "EXPLICIT",
      "derivation_reason": "",
      "allowed_change_paths": ["config_loader.py"],
      "properties": [
        {
          "statement": "validate_config 仅接受 provider 值为 openai 或 local 的配置；其他已提供的 provider 值触发 InvalidConfigError。",
          "requirement_refs": ["R-003"],
          "origin": "EXPLICIT",
          "derivation_reason": ""
        }
      ]
    },
    {
      "node_id": "validate_timeout",
      "title": "校验可选 timeout 为正整数",
      "requirement_refs": ["R-003"],
      "origin": "EXPLICIT",
      "derivation_reason": "",
      "allowed_change_paths": ["config_loader.py"],
      "properties": [
        {
          "statement": "配置包含 timeout 时，validate_config 仅接受正整数；其他值触发 InvalidConfigError。",
          "requirement_refs": ["R-003"],
          "origin": "EXPLICIT",
          "derivation_reason": ""
        },
        {
          "statement": "配置未包含 timeout 时，不因缺少 timeout 而触发该规则的异常。",
          "requirement_refs": ["R-003"],
          "origin": "DERIVED",
          "derivation_reason": "需求以“如果配置里有 timeout”为校验前提。"
        }
      ]
    }
  ],
  "questions_for_mk": []
}